{
  "address": "0xE20002E27831290F8FDA828D014b8B2e9EC399e6",
  "abi": [
    {
      "inputs": [
        {
          "internalType": "contract ArbitrumL1InboxLike",
          "name": "_l1ArbitrumInbox",
          "type": "address"
        },
        {
          "internalType": "contract ArbitrumL1ERC20GatewayLike",
          "name": "_l1ERC20GatewayRouter",
          "type": "address"
        },
        {
          "internalType": "address",
          "name": "_l2RefundL2Address",
          "type": "address"
        },
        {
          "internalType": "contract IERC20",
          "name": "_l1Usdc",
          "type": "address"
        },
        {
          "internalType": "contract ITokenMessenger",
          "name": "_cctpTokenMessenger",
          "type": "address"
        }
      ],
      "stateMutability": "nonpayable",
      "type": "constructor"
    },
    {
      "anonymous": false,
      "inputs": [
        {
          "indexed": false,
          "internalType": "address",
          "name": "target",
          "type": "address"
        },
        {
          "indexed": false,
          "internalType": "bytes",
          "name": "message",
          "type": "bytes"
        }
      ],
      "name": "MessageRelayed",
      "type": "event"
    },
    {
      "anonymous": false,
      "inputs": [
        {
          "indexed": false,
          "internalType": "address",
          "name": "l1Token",
          "type": "address"
        },
        {
          "indexed": false,
          "internalType": "address",
          "name": "l2Token",
          "type": "address"
        },
        {
          "indexed": false,
          "internalType": "uint256",
          "name": "amount",
          "type": "uint256"
        },
        {
          "indexed": false,
          "internalType": "address",
          "name": "to",
          "type": "address"
        }
      ],
      "name": "TokensRelayed",
      "type": "event"
    },
    {
      "inputs": [],
      "name": "RELAY_MESSAGE_L2_GAS_LIMIT",
      "outputs": [
        {
          "internalType": "uint32",
          "name": "",
          "type": "uint32"
        }
      ],
      "stateMutability": "view",
      "type": "function"
    },
    {
      "inputs": [],
      "name": "RELAY_TOKENS_L2_GAS_LIMIT",
      "outputs": [
        {
          "internalType": "uint32",
          "name": "",
          "type": "uint32"
        }
      ],
      "stateMutability": "view",
      "type": "function"
    },
    {
      "inputs": [],
      "name": "cctpTokenMessenger",
      "outputs": [
        {
          "internalType": "contract ITokenMessenger",
          "name": "",
          "type": "address"
        }
      ],
      "stateMutability": "view",
      "type": "function"
    },
    {
      "inputs": [],
      "name": "circleDomainId",
      "outputs": [
        {
          "internalType": "uint32",
          "name": "",
          "type": "uint32"
        }
      ],
      "stateMutability": "view",
      "type": "function"
    },
    {
      "inputs": [
        {
          "internalType": "uint32",
          "name": "l2GasLimit",
          "type": "uint32"
        }
      ],
      "name": "getL1CallValue",
      "outputs": [
        {
          "internalType": "uint256",
          "name": "",
          "type": "uint256"
        }
      ],
      "stateMutability": "pure",
      "type": "function"
    },
    {
      "inputs": [],
      "name": "l1ERC20GatewayRouter",
      "outputs": [
        {
          "internalType": "contract ArbitrumL1ERC20GatewayLike",
          "name": "",
          "type": "address"
        }
      ],
      "stateMutability": "view",
      "type": "function"
    },
    {
      "inputs": [],
      "name": "l1Inbox",
      "outputs": [
        {
          "internalType": "contract ArbitrumL1InboxLike",
          "name": "",
          "type": "address"
        }
      ],
      "stateMutability": "view",
      "type": "function"
    },
    {
      "inputs": [],
      "name": "l1Usdc",
      "outputs": [
        {
          "internalType": "contract IERC20",
          "name": "",
          "type": "address"
        }
      ],
      "stateMutability": "view",
      "type": "function"
    },
    {
      "inputs": [],
      "name": "l2GasPrice",
      "outputs": [
        {
          "internalType": "uint256",
          "name": "",
          "type": "uint256"
        }
      ],
      "stateMutability": "view",
      "type": "function"
    },
    {
      "inputs": [],
      "name": "l2MaxSubmissionCost",
      "outputs": [
        {
          "internalType": "uint256",
          "name": "",
          "type": "uint256"
        }
      ],
      "stateMutability": "view",
      "type": "function"
    },
    {
      "inputs": [],
      "name": "l2RefundL2Address",
      "outputs": [
        {
          "internalType": "address",
          "name": "",
          "type": "address"
        }
      ],
      "stateMutability": "view",
      "type": "function"
    },
    {
      "inputs": [
        {
          "internalType": "address",
          "name": "target",
          "type": "address"
        },
        {
          "internalType": "bytes",
          "name": "message",
          "type": "bytes"
        }
      ],
      "name": "relayMessage",
      "outputs": [],
      "stateMutability": "payable",
      "type": "function"
    },
    {
      "inputs": [
        {
          "internalType": "address",
          "name": "l1Token",
          "type": "address"
        },
        {
          "internalType": "address",
          "name": "l2Token",
          "type": "address"
        },
        {
          "internalType": "uint256",
          "name": "amount",
          "type": "uint256"
        },
        {
          "internalType": "address",
          "name": "to",
          "type": "address"
        }
      ],
      "name": "relayTokens",
      "outputs": [],
      "stateMutability": "payable",
      "type": "function"
    }
  ],
  "transactionHash": "0x457c1870a182f4c9a3fa4a429ab5bd502736e6ec9aea66ea122db136e45b52fb",
  "receipt": {
    "to": null,
    "from": "0x52A79C01f10e6Ea89dED5c3f42F3a0EC362ed090",
    "contractAddress": "0xE20002E27831290F8FDA828D014b8B2e9EC399e6",
    "transactionIndex": 27,
    "gasUsed": "961973",
    "logsBloom": "0x00000000000000000000000000000000000000000000000000000000000000000000000000000000000000000000000000000000000000000000000000000000000000000000000000000000000000000000000000000000000000000000000000000000000000000000000000000000000000000000000000000000000000000000000000000000000000000000000000000000000000000000000000000000000000000000000000000000000000000000000000000000000000000000000000000000000000000000000000000000000000000000000000000000000000000000000000000000000000000000000000000000000000000000000000000000",
    "blockHash": "0x54dc118812e31d93203cfe51199f3f4a5bc9d212d7875a833ac1e98b0c0cad4a",
    "transactionHash": "0x457c1870a182f4c9a3fa4a429ab5bd502736e6ec9aea66ea122db136e45b52fb",
    "logs": [],
    "blockNumber": 10315067,
    "cumulativeGasUsed": "10244315",
    "status": 1,
    "byzantium": true
  },
  "args": [
    "0x6BEbC4925716945D46F0Ec336D5C2564F419682C",
    "0x4c7708168395aEa569453Fc36862D2ffcDaC588c",
    "0x428AB2BA90Eba0a4Be7aF34C9Ac451ab061AC010",
    "0x07865c6E87B9F70255377e024ace6630C1Eaa37F",
    "0xD0C3da58f55358142b8d3e06C1C30c5C6114EFE8"
  ],
  "numDeployments": 2,
  "solcInputHash": "8ccac8cf36ab35df78773cb6892919cd",
  "metadata": "{\"compiler\":{\"version\":\"0.8.23+commit.f704f362\"},\"language\":\"Solidity\",\"output\":{\"abi\":[{\"inputs\":[{\"internalType\":\"contract ArbitrumL1InboxLike\",\"name\":\"_l1ArbitrumInbox\",\"type\":\"address\"},{\"internalType\":\"contract ArbitrumL1ERC20GatewayLike\",\"name\":\"_l1ERC20GatewayRouter\",\"type\":\"address\"},{\"internalType\":\"address\",\"name\":\"_l2RefundL2Address\",\"type\":\"address\"},{\"internalType\":\"contract IERC20\",\"name\":\"_l1Usdc\",\"type\":\"address\"},{\"internalType\":\"contract ITokenMessenger\",\"name\":\"_cctpTokenMessenger\",\"type\":\"address\"}],\"stateMutability\":\"nonpayable\",\"type\":\"constructor\"},{\"anonymous\":false,\"inputs\":[{\"indexed\":false,\"internalType\":\"address\",\"name\":\"target\",\"type\":\"address\"},{\"indexed\":false,\"internalType\":\"bytes\",\"name\":\"message\",\"type\":\"bytes\"}],\"name\":\"MessageRelayed\",\"type\":\"event\"},{\"anonymous\":false,\"inputs\":[{\"indexed\":false,\"internalType\":\"address\",\"name\":\"l1Token\",\"type\":\"address\"},{\"indexed\":false,\"internalType\":\"address\",\"name\":\"l2Token\",\"type\":\"address\"},{\"indexed\":false,\"internalType\":\"uint256\",\"name\":\"amount\",\"type\":\"uint256\"},{\"indexed\":false,\"internalType\":\"address\",\"name\":\"to\",\"type\":\"address\"}],\"name\":\"TokensRelayed\",\"type\":\"event\"},{\"inputs\":[],\"name\":\"RELAY_MESSAGE_L2_GAS_LIMIT\",\"outputs\":[{\"internalType\":\"uint32\",\"name\":\"\",\"type\":\"uint32\"}],\"stateMutability\":\"view\",\"type\":\"function\"},{\"inputs\":[],\"name\":\"RELAY_TOKENS_L2_GAS_LIMIT\",\"outputs\":[{\"internalType\":\"uint32\",\"name\":\"\",\"type\":\"uint32\"}],\"stateMutability\":\"view\",\"type\":\"function\"},{\"inputs\":[],\"name\":\"cctpTokenMessenger\",\"outputs\":[{\"internalType\":\"contract ITokenMessenger\",\"name\":\"\",\"type\":\"address\"}],\"stateMutability\":\"view\",\"type\":\"function\"},{\"inputs\":[],\"name\":\"circleDomainId\",\"outputs\":[{\"internalType\":\"uint32\",\"name\":\"\",\"type\":\"uint32\"}],\"stateMutability\":\"view\",\"type\":\"function\"},{\"inputs\":[{\"internalType\":\"uint32\",\"name\":\"l2GasLimit\",\"type\":\"uint32\"}],\"name\":\"getL1CallValue\",\"outputs\":[{\"internalType\":\"uint256\",\"name\":\"\",\"type\":\"uint256\"}],\"stateMutability\":\"pure\",\"type\":\"function\"},{\"inputs\":[],\"name\":\"l1ERC20GatewayRouter\",\"outputs\":[{\"internalType\":\"contract ArbitrumL1ERC20GatewayLike\",\"name\":\"\",\"type\":\"address\"}],\"stateMutability\":\"view\",\"type\":\"function\"},{\"inputs\":[],\"name\":\"l1Inbox\",\"outputs\":[{\"internalType\":\"contract ArbitrumL1InboxLike\",\"name\":\"\",\"type\":\"address\"}],\"stateMutability\":\"view\",\"type\":\"function\"},{\"inputs\":[],\"name\":\"l1Usdc\",\"outputs\":[{\"internalType\":\"contract IERC20\",\"name\":\"\",\"type\":\"address\"}],\"stateMutability\":\"view\",\"type\":\"function\"},{\"inputs\":[],\"name\":\"l2GasPrice\",\"outputs\":[{\"internalType\":\"uint256\",\"name\":\"\",\"type\":\"uint256\"}],\"stateMutability\":\"view\",\"type\":\"function\"},{\"inputs\":[],\"name\":\"l2MaxSubmissionCost\",\"outputs\":[{\"internalType\":\"uint256\",\"name\":\"\",\"type\":\"uint256\"}],\"stateMutability\":\"view\",\"type\":\"function\"},{\"inputs\":[],\"name\":\"l2RefundL2Address\",\"outputs\":[{\"internalType\":\"address\",\"name\":\"\",\"type\":\"address\"}],\"stateMutability\":\"view\",\"type\":\"function\"},{\"inputs\":[{\"internalType\":\"address\",\"name\":\"target\",\"type\":\"address\"},{\"internalType\":\"bytes\",\"name\":\"message\",\"type\":\"bytes\"}],\"name\":\"relayMessage\",\"outputs\":[],\"stateMutability\":\"payable\",\"type\":\"function\"},{\"inputs\":[{\"internalType\":\"address\",\"name\":\"l1Token\",\"type\":\"address\"},{\"internalType\":\"address\",\"name\":\"l2Token\",\"type\":\"address\"},{\"internalType\":\"uint256\",\"name\":\"amount\",\"type\":\"uint256\"},{\"internalType\":\"address\",\"name\":\"to\",\"type\":\"address\"}],\"name\":\"relayTokens\",\"outputs\":[],\"stateMutability\":\"payable\",\"type\":\"function\"}],\"devdoc\":{\"details\":\"Public functions calling external contracts do not guard against reentrancy because they are expected to be called via delegatecall, which will execute this contract's logic within the context of the originating contract. For example, the HubPool will delegatecall these functions, therefore its only necessary that the HubPool's methods that call this contract's logic guard against reentrancy.\",\"kind\":\"dev\",\"methods\":{\"constructor\":{\"params\":{\"_cctpTokenMessenger\":\"TokenMessenger contract to bridge via CCTP.\",\"_l1ArbitrumInbox\":\"Inbox helper contract to send messages to Arbitrum.\",\"_l1ERC20GatewayRouter\":\"ERC20 gateway router contract to send tokens to Arbitrum.\",\"_l1Usdc\":\"USDC address on L1.\",\"_l2RefundL2Address\":\"L2 address to receive gas refunds on after a message is relayed.\"}},\"getL1CallValue(uint32)\":{\"returns\":{\"_0\":\"amount of ETH that this contract needs to hold in order for relayMessage to succeed.\"}},\"relayMessage(address,bytes)\":{\"params\":{\"message\":\"Data to send to target.\",\"target\":\"Contract on Arbitrum that will receive message.\"}},\"relayTokens(address,address,uint256,address)\":{\"params\":{\"amount\":\"Amount of L1 tokens to deposit and L2 tokens to receive.\",\"l1Token\":\"L1 token to deposit.\",\"l2Token\":\"L2 token to receive.\",\"to\":\"Bridge recipient.\"}}},\"stateVariables\":{\"cctpTokenMessenger\":{\"details\":\"Posted officially here: https://developers.circle.com/stablecoins/docs/evm-smart-contracts\"},\"circleDomainId\":{\"details\":\"This identifier is assigned by Circle and is not related to a chain ID.Official domain list can be found here: https://developers.circle.com/stablecoins/docs/supported-domains\"},\"l1Usdc\":{\"details\":\"Posted officially here: https://developers.circle.com/stablecoins/docs/usdc-on-main-networks\"}},\"version\":1},\"userdoc\":{\"kind\":\"user\",\"methods\":{\"cctpTokenMessenger()\":{\"notice\":\"The official Circle CCTP token bridge contract endpoint.\"},\"circleDomainId()\":{\"notice\":\"Domain identifier used for Circle's CCTP bridge on Arbitrum.\"},\"constructor\":{\"notice\":\"Constructs new Adapter.\"},\"getL1CallValue(uint32)\":{\"notice\":\"Returns required amount of ETH to send a message via the Inbox.\"},\"l1Usdc()\":{\"notice\":\"The official USDC contract address on this chain.\"},\"relayMessage(address,bytes)\":{\"notice\":\"Send cross-chain message to target on Arbitrum.This contract must hold at least getL1CallValue() amount of ETH to send a message via the Inbox successfully, or the message will get stuck.\"},\"relayTokens(address,address,uint256,address)\":{\"notice\":\"Bridge tokens to Arbitrum.This contract must hold at least getL1CallValue() amount of ETH to send a message via the Inbox successfully, or the message will get stuck.\"}},\"notice\":\"Contract containing logic to send messages from L1 to Arbitrum.\",\"version\":1}},\"settings\":{\"compilationTarget\":{\"contracts/chain-adapters/Arbitrum_Adapter.sol\":\"Arbitrum_Adapter\"},\"evmVersion\":\"shanghai\",\"libraries\":{},\"metadata\":{\"bytecodeHash\":\"ipfs\",\"useLiteralContent\":true},\"optimizer\":{\"enabled\":true,\"runs\":1000000},\"remappings\":[],\"viaIR\":true},\"sources\":{\"@openzeppelin/contracts/token/ERC20/IERC20.sol\":{\"content\":\"// SPDX-License-Identifier: MIT\\n// OpenZeppelin Contracts (last updated v4.9.0) (token/ERC20/IERC20.sol)\\n\\npragma solidity ^0.8.0;\\n\\n/**\\n * @dev Interface of the ERC20 standard as defined in the EIP.\\n */\\ninterface IERC20 {\\n    /**\\n     * @dev Emitted when `value` tokens are moved from one account (`from`) to\\n     * another (`to`).\\n     *\\n     * Note that `value` may be zero.\\n     */\\n    event Transfer(address indexed from, address indexed to, uint256 value);\\n\\n    /**\\n     * @dev Emitted when the allowance of a `spender` for an `owner` is set by\\n     * a call to {approve}. `value` is the new allowance.\\n     */\\n    event Approval(address indexed owner, address indexed spender, uint256 value);\\n\\n    /**\\n     * @dev Returns the amount of tokens in existence.\\n     */\\n    function totalSupply() external view returns (uint256);\\n\\n    /**\\n     * @dev Returns the amount of tokens owned by `account`.\\n     */\\n    function balanceOf(address account) external view returns (uint256);\\n\\n    /**\\n     * @dev Moves `amount` tokens from the caller's account to `to`.\\n     *\\n     * Returns a boolean value indicating whether the operation succeeded.\\n     *\\n     * Emits a {Transfer} event.\\n     */\\n    function transfer(address to, uint256 amount) external returns (bool);\\n\\n    /**\\n     * @dev Returns the remaining number of tokens that `spender` will be\\n     * allowed to spend on behalf of `owner` through {transferFrom}. This is\\n     * zero by default.\\n     *\\n     * This value changes when {approve} or {transferFrom} are called.\\n     */\\n    function allowance(address owner, address spender) external view returns (uint256);\\n\\n    /**\\n     * @dev Sets `amount` as the allowance of `spender` over the caller's tokens.\\n     *\\n     * Returns a boolean value indicating whether the operation succeeded.\\n     *\\n     * IMPORTANT: Beware that changing an allowance with this method brings the risk\\n     * that someone may use both the old and the new allowance by unfortunate\\n     * transaction ordering. One possible solution to mitigate this race\\n     * condition is to first reduce the spender's allowance to 0 and set the\\n     * desired value afterwards:\\n     * https://github.com/ethereum/EIPs/issues/20#issuecomment-263524729\\n     *\\n     * Emits an {Approval} event.\\n     */\\n    function approve(address spender, uint256 amount) external returns (bool);\\n\\n    /**\\n     * @dev Moves `amount` tokens from `from` to `to` using the\\n     * allowance mechanism. `amount` is then deducted from the caller's\\n     * allowance.\\n     *\\n     * Returns a boolean value indicating whether the operation succeeded.\\n     *\\n     * Emits a {Transfer} event.\\n     */\\n    function transferFrom(address from, address to, uint256 amount) external returns (bool);\\n}\\n\",\"keccak256\":\"0x287b55befed2961a7eabd7d7b1b2839cbca8a5b80ef8dcbb25ed3d4c2002c305\",\"license\":\"MIT\"},\"@openzeppelin/contracts/token/ERC20/extensions/IERC20Permit.sol\":{\"content\":\"// SPDX-License-Identifier: MIT\\n// OpenZeppelin Contracts (last updated v4.9.0) (token/ERC20/extensions/IERC20Permit.sol)\\n\\npragma solidity ^0.8.0;\\n\\n/**\\n * @dev Interface of the ERC20 Permit extension allowing approvals to be made via signatures, as defined in\\n * https://eips.ethereum.org/EIPS/eip-2612[EIP-2612].\\n *\\n * Adds the {permit} method, which can be used to change an account's ERC20 allowance (see {IERC20-allowance}) by\\n * presenting a message signed by the account. By not relying on {IERC20-approve}, the token holder account doesn't\\n * need to send a transaction, and thus is not required to hold Ether at all.\\n */\\ninterface IERC20Permit {\\n    /**\\n     * @dev Sets `value` as the allowance of `spender` over ``owner``'s tokens,\\n     * given ``owner``'s signed approval.\\n     *\\n     * IMPORTANT: The same issues {IERC20-approve} has related to transaction\\n     * ordering also apply here.\\n     *\\n     * Emits an {Approval} event.\\n     *\\n     * Requirements:\\n     *\\n     * - `spender` cannot be the zero address.\\n     * - `deadline` must be a timestamp in the future.\\n     * - `v`, `r` and `s` must be a valid `secp256k1` signature from `owner`\\n     * over the EIP712-formatted function arguments.\\n     * - the signature must use ``owner``'s current nonce (see {nonces}).\\n     *\\n     * For more information on the signature format, see the\\n     * https://eips.ethereum.org/EIPS/eip-2612#specification[relevant EIP\\n     * section].\\n     */\\n    function permit(\\n        address owner,\\n        address spender,\\n        uint256 value,\\n        uint256 deadline,\\n        uint8 v,\\n        bytes32 r,\\n        bytes32 s\\n    ) external;\\n\\n    /**\\n     * @dev Returns the current nonce for `owner`. This value must be\\n     * included whenever a signature is generated for {permit}.\\n     *\\n     * Every successful call to {permit} increases ``owner``'s nonce by one. This\\n     * prevents a signature from being used multiple times.\\n     */\\n    function nonces(address owner) external view returns (uint256);\\n\\n    /**\\n     * @dev Returns the domain separator used in the encoding of the signature for {permit}, as defined by {EIP712}.\\n     */\\n    // solhint-disable-next-line func-name-mixedcase\\n    function DOMAIN_SEPARATOR() external view returns (bytes32);\\n}\\n\",\"keccak256\":\"0xec63854014a5b4f2b3290ab9103a21bdf902a508d0f41a8573fea49e98bf571a\",\"license\":\"MIT\"},\"@openzeppelin/contracts/token/ERC20/utils/SafeERC20.sol\":{\"content\":\"// SPDX-License-Identifier: MIT\\n// OpenZeppelin Contracts (last updated v4.9.3) (token/ERC20/utils/SafeERC20.sol)\\n\\npragma solidity ^0.8.0;\\n\\nimport \\\"../IERC20.sol\\\";\\nimport \\\"../extensions/IERC20Permit.sol\\\";\\nimport \\\"../../../utils/Address.sol\\\";\\n\\n/**\\n * @title SafeERC20\\n * @dev Wrappers around ERC20 operations that throw on failure (when the token\\n * contract returns false). Tokens that return no value (and instead revert or\\n * throw on failure) are also supported, non-reverting calls are assumed to be\\n * successful.\\n * To use this library you can add a `using SafeERC20 for IERC20;` statement to your contract,\\n * which allows you to call the safe operations as `token.safeTransfer(...)`, etc.\\n */\\nlibrary SafeERC20 {\\n    using Address for address;\\n\\n    /**\\n     * @dev Transfer `value` amount of `token` from the calling contract to `to`. If `token` returns no value,\\n     * non-reverting calls are assumed to be successful.\\n     */\\n    function safeTransfer(IERC20 token, address to, uint256 value) internal {\\n        _callOptionalReturn(token, abi.encodeWithSelector(token.transfer.selector, to, value));\\n    }\\n\\n    /**\\n     * @dev Transfer `value` amount of `token` from `from` to `to`, spending the approval given by `from` to the\\n     * calling contract. If `token` returns no value, non-reverting calls are assumed to be successful.\\n     */\\n    function safeTransferFrom(IERC20 token, address from, address to, uint256 value) internal {\\n        _callOptionalReturn(token, abi.encodeWithSelector(token.transferFrom.selector, from, to, value));\\n    }\\n\\n    /**\\n     * @dev Deprecated. This function has issues similar to the ones found in\\n     * {IERC20-approve}, and its usage is discouraged.\\n     *\\n     * Whenever possible, use {safeIncreaseAllowance} and\\n     * {safeDecreaseAllowance} instead.\\n     */\\n    function safeApprove(IERC20 token, address spender, uint256 value) internal {\\n        // safeApprove should only be called when setting an initial allowance,\\n        // or when resetting it to zero. To increase and decrease it, use\\n        // 'safeIncreaseAllowance' and 'safeDecreaseAllowance'\\n        require(\\n            (value == 0) || (token.allowance(address(this), spender) == 0),\\n            \\\"SafeERC20: approve from non-zero to non-zero allowance\\\"\\n        );\\n        _callOptionalReturn(token, abi.encodeWithSelector(token.approve.selector, spender, value));\\n    }\\n\\n    /**\\n     * @dev Increase the calling contract's allowance toward `spender` by `value`. If `token` returns no value,\\n     * non-reverting calls are assumed to be successful.\\n     */\\n    function safeIncreaseAllowance(IERC20 token, address spender, uint256 value) internal {\\n        uint256 oldAllowance = token.allowance(address(this), spender);\\n        _callOptionalReturn(token, abi.encodeWithSelector(token.approve.selector, spender, oldAllowance + value));\\n    }\\n\\n    /**\\n     * @dev Decrease the calling contract's allowance toward `spender` by `value`. If `token` returns no value,\\n     * non-reverting calls are assumed to be successful.\\n     */\\n    function safeDecreaseAllowance(IERC20 token, address spender, uint256 value) internal {\\n        unchecked {\\n            uint256 oldAllowance = token.allowance(address(this), spender);\\n            require(oldAllowance >= value, \\\"SafeERC20: decreased allowance below zero\\\");\\n            _callOptionalReturn(token, abi.encodeWithSelector(token.approve.selector, spender, oldAllowance - value));\\n        }\\n    }\\n\\n    /**\\n     * @dev Set the calling contract's allowance toward `spender` to `value`. If `token` returns no value,\\n     * non-reverting calls are assumed to be successful. Meant to be used with tokens that require the approval\\n     * to be set to zero before setting it to a non-zero value, such as USDT.\\n     */\\n    function forceApprove(IERC20 token, address spender, uint256 value) internal {\\n        bytes memory approvalCall = abi.encodeWithSelector(token.approve.selector, spender, value);\\n\\n        if (!_callOptionalReturnBool(token, approvalCall)) {\\n            _callOptionalReturn(token, abi.encodeWithSelector(token.approve.selector, spender, 0));\\n            _callOptionalReturn(token, approvalCall);\\n        }\\n    }\\n\\n    /**\\n     * @dev Use a ERC-2612 signature to set the `owner` approval toward `spender` on `token`.\\n     * Revert on invalid signature.\\n     */\\n    function safePermit(\\n        IERC20Permit token,\\n        address owner,\\n        address spender,\\n        uint256 value,\\n        uint256 deadline,\\n        uint8 v,\\n        bytes32 r,\\n        bytes32 s\\n    ) internal {\\n        uint256 nonceBefore = token.nonces(owner);\\n        token.permit(owner, spender, value, deadline, v, r, s);\\n        uint256 nonceAfter = token.nonces(owner);\\n        require(nonceAfter == nonceBefore + 1, \\\"SafeERC20: permit did not succeed\\\");\\n    }\\n\\n    /**\\n     * @dev Imitates a Solidity high-level call (i.e. a regular function call to a contract), relaxing the requirement\\n     * on the return value: the return value is optional (but if data is returned, it must not be false).\\n     * @param token The token targeted by the call.\\n     * @param data The call data (encoded using abi.encode or one of its variants).\\n     */\\n    function _callOptionalReturn(IERC20 token, bytes memory data) private {\\n        // We need to perform a low level call here, to bypass Solidity's return data size checking mechanism, since\\n        // we're implementing it ourselves. We use {Address-functionCall} to perform this call, which verifies that\\n        // the target address contains contract code and also asserts for success in the low-level call.\\n\\n        bytes memory returndata = address(token).functionCall(data, \\\"SafeERC20: low-level call failed\\\");\\n        require(returndata.length == 0 || abi.decode(returndata, (bool)), \\\"SafeERC20: ERC20 operation did not succeed\\\");\\n    }\\n\\n    /**\\n     * @dev Imitates a Solidity high-level call (i.e. a regular function call to a contract), relaxing the requirement\\n     * on the return value: the return value is optional (but if data is returned, it must not be false).\\n     * @param token The token targeted by the call.\\n     * @param data The call data (encoded using abi.encode or one of its variants).\\n     *\\n     * This is a variant of {_callOptionalReturn} that silents catches all reverts and returns a bool instead.\\n     */\\n    function _callOptionalReturnBool(IERC20 token, bytes memory data) private returns (bool) {\\n        // We need to perform a low level call here, to bypass Solidity's return data size checking mechanism, since\\n        // we're implementing it ourselves. We cannot use {Address-functionCall} here since this should return false\\n        // and not revert is the subcall reverts.\\n\\n        (bool success, bytes memory returndata) = address(token).call(data);\\n        return\\n            success && (returndata.length == 0 || abi.decode(returndata, (bool))) && Address.isContract(address(token));\\n    }\\n}\\n\",\"keccak256\":\"0xabefac93435967b4d36a4fabcbdbb918d1f0b7ae3c3d85bc30923b326c927ed1\",\"license\":\"MIT\"},\"@openzeppelin/contracts/utils/Address.sol\":{\"content\":\"// SPDX-License-Identifier: MIT\\n// OpenZeppelin Contracts (last updated v4.9.0) (utils/Address.sol)\\n\\npragma solidity ^0.8.1;\\n\\n/**\\n * @dev Collection of functions related to the address type\\n */\\nlibrary Address {\\n    /**\\n     * @dev Returns true if `account` is a contract.\\n     *\\n     * [IMPORTANT]\\n     * ====\\n     * It is unsafe to assume that an address for which this function returns\\n     * false is an externally-owned account (EOA) and not a contract.\\n     *\\n     * Among others, `isContract` will return false for the following\\n     * types of addresses:\\n     *\\n     *  - an externally-owned account\\n     *  - a contract in construction\\n     *  - an address where a contract will be created\\n     *  - an address where a contract lived, but was destroyed\\n     *\\n     * Furthermore, `isContract` will also return true if the target contract within\\n     * the same transaction is already scheduled for destruction by `SELFDESTRUCT`,\\n     * which only has an effect at the end of a transaction.\\n     * ====\\n     *\\n     * [IMPORTANT]\\n     * ====\\n     * You shouldn't rely on `isContract` to protect against flash loan attacks!\\n     *\\n     * Preventing calls from contracts is highly discouraged. It breaks composability, breaks support for smart wallets\\n     * like Gnosis Safe, and does not provide security since it can be circumvented by calling from a contract\\n     * constructor.\\n     * ====\\n     */\\n    function isContract(address account) internal view returns (bool) {\\n        // This method relies on extcodesize/address.code.length, which returns 0\\n        // for contracts in construction, since the code is only stored at the end\\n        // of the constructor execution.\\n\\n        return account.code.length > 0;\\n    }\\n\\n    /**\\n     * @dev Replacement for Solidity's `transfer`: sends `amount` wei to\\n     * `recipient`, forwarding all available gas and reverting on errors.\\n     *\\n     * https://eips.ethereum.org/EIPS/eip-1884[EIP1884] increases the gas cost\\n     * of certain opcodes, possibly making contracts go over the 2300 gas limit\\n     * imposed by `transfer`, making them unable to receive funds via\\n     * `transfer`. {sendValue} removes this limitation.\\n     *\\n     * https://consensys.net/diligence/blog/2019/09/stop-using-soliditys-transfer-now/[Learn more].\\n     *\\n     * IMPORTANT: because control is transferred to `recipient`, care must be\\n     * taken to not create reentrancy vulnerabilities. Consider using\\n     * {ReentrancyGuard} or the\\n     * https://solidity.readthedocs.io/en/v0.8.0/security-considerations.html#use-the-checks-effects-interactions-pattern[checks-effects-interactions pattern].\\n     */\\n    function sendValue(address payable recipient, uint256 amount) internal {\\n        require(address(this).balance >= amount, \\\"Address: insufficient balance\\\");\\n\\n        (bool success, ) = recipient.call{value: amount}(\\\"\\\");\\n        require(success, \\\"Address: unable to send value, recipient may have reverted\\\");\\n    }\\n\\n    /**\\n     * @dev Performs a Solidity function call using a low level `call`. A\\n     * plain `call` is an unsafe replacement for a function call: use this\\n     * function instead.\\n     *\\n     * If `target` reverts with a revert reason, it is bubbled up by this\\n     * function (like regular Solidity function calls).\\n     *\\n     * Returns the raw returned data. To convert to the expected return value,\\n     * use https://solidity.readthedocs.io/en/latest/units-and-global-variables.html?highlight=abi.decode#abi-encoding-and-decoding-functions[`abi.decode`].\\n     *\\n     * Requirements:\\n     *\\n     * - `target` must be a contract.\\n     * - calling `target` with `data` must not revert.\\n     *\\n     * _Available since v3.1._\\n     */\\n    function functionCall(address target, bytes memory data) internal returns (bytes memory) {\\n        return functionCallWithValue(target, data, 0, \\\"Address: low-level call failed\\\");\\n    }\\n\\n    /**\\n     * @dev Same as {xref-Address-functionCall-address-bytes-}[`functionCall`], but with\\n     * `errorMessage` as a fallback revert reason when `target` reverts.\\n     *\\n     * _Available since v3.1._\\n     */\\n    function functionCall(\\n        address target,\\n        bytes memory data,\\n        string memory errorMessage\\n    ) internal returns (bytes memory) {\\n        return functionCallWithValue(target, data, 0, errorMessage);\\n    }\\n\\n    /**\\n     * @dev Same as {xref-Address-functionCall-address-bytes-}[`functionCall`],\\n     * but also transferring `value` wei to `target`.\\n     *\\n     * Requirements:\\n     *\\n     * - the calling contract must have an ETH balance of at least `value`.\\n     * - the called Solidity function must be `payable`.\\n     *\\n     * _Available since v3.1._\\n     */\\n    function functionCallWithValue(address target, bytes memory data, uint256 value) internal returns (bytes memory) {\\n        return functionCallWithValue(target, data, value, \\\"Address: low-level call with value failed\\\");\\n    }\\n\\n    /**\\n     * @dev Same as {xref-Address-functionCallWithValue-address-bytes-uint256-}[`functionCallWithValue`], but\\n     * with `errorMessage` as a fallback revert reason when `target` reverts.\\n     *\\n     * _Available since v3.1._\\n     */\\n    function functionCallWithValue(\\n        address target,\\n        bytes memory data,\\n        uint256 value,\\n        string memory errorMessage\\n    ) internal returns (bytes memory) {\\n        require(address(this).balance >= value, \\\"Address: insufficient balance for call\\\");\\n        (bool success, bytes memory returndata) = target.call{value: value}(data);\\n        return verifyCallResultFromTarget(target, success, returndata, errorMessage);\\n    }\\n\\n    /**\\n     * @dev Same as {xref-Address-functionCall-address-bytes-}[`functionCall`],\\n     * but performing a static call.\\n     *\\n     * _Available since v3.3._\\n     */\\n    function functionStaticCall(address target, bytes memory data) internal view returns (bytes memory) {\\n        return functionStaticCall(target, data, \\\"Address: low-level static call failed\\\");\\n    }\\n\\n    /**\\n     * @dev Same as {xref-Address-functionCall-address-bytes-string-}[`functionCall`],\\n     * but performing a static call.\\n     *\\n     * _Available since v3.3._\\n     */\\n    function functionStaticCall(\\n        address target,\\n        bytes memory data,\\n        string memory errorMessage\\n    ) internal view returns (bytes memory) {\\n        (bool success, bytes memory returndata) = target.staticcall(data);\\n        return verifyCallResultFromTarget(target, success, returndata, errorMessage);\\n    }\\n\\n    /**\\n     * @dev Same as {xref-Address-functionCall-address-bytes-}[`functionCall`],\\n     * but performing a delegate call.\\n     *\\n     * _Available since v3.4._\\n     */\\n    function functionDelegateCall(address target, bytes memory data) internal returns (bytes memory) {\\n        return functionDelegateCall(target, data, \\\"Address: low-level delegate call failed\\\");\\n    }\\n\\n    /**\\n     * @dev Same as {xref-Address-functionCall-address-bytes-string-}[`functionCall`],\\n     * but performing a delegate call.\\n     *\\n     * _Available since v3.4._\\n     */\\n    function functionDelegateCall(\\n        address target,\\n        bytes memory data,\\n        string memory errorMessage\\n    ) internal returns (bytes memory) {\\n        (bool success, bytes memory returndata) = target.delegatecall(data);\\n        return verifyCallResultFromTarget(target, success, returndata, errorMessage);\\n    }\\n\\n    /**\\n     * @dev Tool to verify that a low level call to smart-contract was successful, and revert (either by bubbling\\n     * the revert reason or using the provided one) in case of unsuccessful call or if target was not a contract.\\n     *\\n     * _Available since v4.8._\\n     */\\n    function verifyCallResultFromTarget(\\n        address target,\\n        bool success,\\n        bytes memory returndata,\\n        string memory errorMessage\\n    ) internal view returns (bytes memory) {\\n        if (success) {\\n            if (returndata.length == 0) {\\n                // only check isContract if the call was successful and the return data is empty\\n                // otherwise we already know that it was a contract\\n                require(isContract(target), \\\"Address: call to non-contract\\\");\\n            }\\n            return returndata;\\n        } else {\\n            _revert(returndata, errorMessage);\\n        }\\n    }\\n\\n    /**\\n     * @dev Tool to verify that a low level call was successful, and revert if it wasn't, either by bubbling the\\n     * revert reason or using the provided one.\\n     *\\n     * _Available since v4.3._\\n     */\\n    function verifyCallResult(\\n        bool success,\\n        bytes memory returndata,\\n        string memory errorMessage\\n    ) internal pure returns (bytes memory) {\\n        if (success) {\\n            return returndata;\\n        } else {\\n            _revert(returndata, errorMessage);\\n        }\\n    }\\n\\n    function _revert(bytes memory returndata, string memory errorMessage) private pure {\\n        // Look for revert reason and bubble it up if present\\n        if (returndata.length > 0) {\\n            // The easiest way to bubble the revert reason is using memory via assembly\\n            /// @solidity memory-safe-assembly\\n            assembly {\\n                let returndata_size := mload(returndata)\\n                revert(add(32, returndata), returndata_size)\\n            }\\n        } else {\\n            revert(errorMessage);\\n        }\\n    }\\n}\\n\",\"keccak256\":\"0x006dd67219697fe68d7fbfdea512e7c4cb64a43565ed86171d67e844982da6fa\",\"license\":\"MIT\"},\"contracts/chain-adapters/Arbitrum_Adapter.sol\":{\"content\":\"// SPDX-License-Identifier: BUSL-1.1\\npragma solidity ^0.8.0;\\n\\nimport \\\"./interfaces/AdapterInterface.sol\\\";\\n\\nimport \\\"@openzeppelin/contracts/token/ERC20/IERC20.sol\\\";\\nimport \\\"@openzeppelin/contracts/token/ERC20/utils/SafeERC20.sol\\\";\\nimport \\\"../external/interfaces/CCTPInterfaces.sol\\\";\\nimport \\\"../libraries/CircleCCTPLib.sol\\\";\\n\\n/**\\n * @notice Interface for Arbitrum's L1 Inbox contract used to send messages to Arbitrum.\\n */\\ninterface ArbitrumL1InboxLike {\\n    /**\\n     * @notice Put a message in the L2 inbox that can be reexecuted for some fixed amount of time if it reverts\\n     * @dev Gas limit and maxFeePerGas should not be set to 1 as that is used to trigger the RetryableData error\\n     * @dev Caller must set msg.value equal to at least `maxSubmissionCost + maxGas * gasPriceBid`.\\n     *      all msg.value will deposited to callValueRefundAddress on L2\\n     * @dev More details can be found here: https://developer.arbitrum.io/arbos/l1-to-l2-messaging\\n     * @param to destination L2 contract address\\n     * @param l2CallValue call value for retryable L2 message\\n     * @param maxSubmissionCost Max gas deducted from user's L2 balance to cover base submission fee\\n     * @param excessFeeRefundAddress gasLimit x maxFeePerGas - execution cost gets credited here on L2 balance\\n     * @param callValueRefundAddress l2Callvalue gets credited here on L2 if retryable txn times out or gets cancelled\\n     * @param gasLimit Max gas deducted from user's L2 balance to cover L2 execution. Should not be set to 1 (magic value used to trigger the RetryableData error)\\n     * @param maxFeePerGas price bid for L2 execution. Should not be set to 1 (magic value used to trigger the RetryableData error)\\n     * @param data ABI encoded data of L2 message\\n     * @return unique message number of the retryable transaction\\n     */\\n    function createRetryableTicket(\\n        address to,\\n        uint256 l2CallValue,\\n        uint256 maxSubmissionCost,\\n        address excessFeeRefundAddress,\\n        address callValueRefundAddress,\\n        uint256 gasLimit,\\n        uint256 maxFeePerGas,\\n        bytes calldata data\\n    ) external payable returns (uint256);\\n\\n    /**\\n     * @notice Put a message in the L2 inbox that can be reexecuted for some fixed amount of time if it reverts\\n     * @dev Same as createRetryableTicket, but does not guarantee that submission will succeed by requiring the needed\\n     * funds come from the deposit alone, rather than falling back on the user's L2 balance\\n     * @dev Advanced usage only (does not rewrite aliases for excessFeeRefundAddress and callValueRefundAddress).\\n     * createRetryableTicket method is the recommended standard.\\n     * @dev Gas limit and maxFeePerGas should not be set to 1 as that is used to trigger the RetryableData error\\n     * @param to destination L2 contract address\\n     * @param l2CallValue call value for retryable L2 message\\n     * @param maxSubmissionCost Max gas deducted from user's L2 balance to cover base submission fee\\n     * @param excessFeeRefundAddress gasLimit x maxFeePerGas - execution cost gets credited here on L2 balance\\n     * @param callValueRefundAddress l2Callvalue gets credited here on L2 if retryable txn times out or gets cancelled\\n     * @param gasLimit Max gas deducted from user's L2 balance to cover L2 execution. Should not be set to 1 (magic value used to trigger the RetryableData error)\\n     * @param maxFeePerGas price bid for L2 execution. Should not be set to 1 (magic value used to trigger the RetryableData error)\\n     * @param data ABI encoded data of L2 message\\n     * @return unique message number of the retryable transaction\\n     */\\n    function unsafeCreateRetryableTicket(\\n        address to,\\n        uint256 l2CallValue,\\n        uint256 maxSubmissionCost,\\n        address excessFeeRefundAddress,\\n        address callValueRefundAddress,\\n        uint256 gasLimit,\\n        uint256 maxFeePerGas,\\n        bytes calldata data\\n    ) external payable returns (uint256);\\n}\\n\\n/**\\n * @notice Layer 1 Gateway contract for bridging standard ERC20s to Arbitrum.\\n */\\ninterface ArbitrumL1ERC20GatewayLike {\\n    /**\\n     * @notice Deprecated in favor of outboundTransferCustomRefund but still used in custom bridges\\n     * like the DAI bridge.\\n     * @dev Refunded to aliased L2 address of sender if sender has code on L1, otherwise to to sender's EOA on L2.\\n     * @param _l1Token L1 address of ERC20\\n     * @param _to Account to be credited with the tokens in the L2 (can be the user's L2 account or a contract),\\n     * not subject to L2 aliasing. This account, or its L2 alias if it have code in L1, will also be able to\\n     * cancel the retryable ticket and receive callvalue refund\\n     * @param _amount Token Amount\\n     * @param _maxGas Max gas deducted from user's L2 balance to cover L2 execution\\n     * @param _gasPriceBid Gas price for L2 execution\\n     * @param _data encoded data from router and user\\n     * @return res abi encoded inbox sequence number\\n     */\\n    function outboundTransfer(\\n        address _l1Token,\\n        address _to,\\n        uint256 _amount,\\n        uint256 _maxGas,\\n        uint256 _gasPriceBid,\\n        bytes calldata _data\\n    ) external payable returns (bytes memory);\\n\\n    /**\\n     * @notice Deposit ERC20 token from Ethereum into Arbitrum.\\n     * @dev L2 address alias will not be applied to the following types of addresses on L1:\\n     *      - an externally-owned account\\n     *      - a contract in construction\\n     *      - an address where a contract will be created\\n     *      - an address where a contract lived, but was destroyed\\n     * @param _l1Token L1 address of ERC20\\n     * @param _refundTo Account, or its L2 alias if it have code in L1, to be credited with excess gas refund in L2\\n     * @param _to Account to be credited with the tokens in the L2 (can be the user's L2 account or a contract),\\n     * not subject to L2 aliasing. This account, or its L2 alias if it have code in L1, will also be able to\\n     * cancel the retryable ticket and receive callvalue refund\\n     * @param _amount Token Amount\\n     * @param _maxGas Max gas deducted from user's L2 balance to cover L2 execution\\n     * @param _gasPriceBid Gas price for L2 execution\\n     * @param _data encoded data from router and user\\n     * @return res abi encoded inbox sequence number\\n     */\\n    function outboundTransferCustomRefund(\\n        address _l1Token,\\n        address _refundTo,\\n        address _to,\\n        uint256 _amount,\\n        uint256 _maxGas,\\n        uint256 _gasPriceBid,\\n        bytes calldata _data\\n    ) external payable returns (bytes memory);\\n\\n    /**\\n     * @notice get ERC20 gateway for token.\\n     * @param _token ERC20 address.\\n     * @return address of ERC20 gateway.\\n     */\\n    function getGateway(address _token) external view returns (address);\\n}\\n\\n/**\\n * @notice Contract containing logic to send messages from L1 to Arbitrum.\\n * @dev Public functions calling external contracts do not guard against reentrancy because they are expected to be\\n * called via delegatecall, which will execute this contract's logic within the context of the originating contract.\\n * For example, the HubPool will delegatecall these functions, therefore its only necessary that the HubPool's methods\\n * that call this contract's logic guard against reentrancy.\\n */\\n\\n// solhint-disable-next-line contract-name-camelcase\\ncontract Arbitrum_Adapter is AdapterInterface {\\n    using SafeERC20 for IERC20;\\n\\n    // Amount of ETH allocated to pay for the base submission fee. The base submission fee is a parameter unique to\\n    // retryable transactions; the user is charged the base submission fee to cover the storage costs of keeping their\\n    // ticket\\u2019s calldata in the retry buffer. (current base submission fee is queryable via\\n    // ArbRetryableTx.getSubmissionPrice). ArbRetryableTicket precompile interface exists at L2 address\\n    // 0x000000000000000000000000000000000000006E.\\n    uint256 public constant l2MaxSubmissionCost = 0.01e18;\\n\\n    // L2 Gas price bid for immediate L2 execution attempt (queryable via standard eth*gasPrice RPC)\\n    uint256 public constant l2GasPrice = 5e9; // 5 gWei\\n\\n    uint32 public constant RELAY_TOKENS_L2_GAS_LIMIT = 300_000;\\n    uint32 public constant RELAY_MESSAGE_L2_GAS_LIMIT = 2_000_000;\\n\\n    // This address on L2 receives extra ETH that is left over after relaying a message via the inbox.\\n    address public immutable l2RefundL2Address;\\n\\n    ArbitrumL1InboxLike public immutable l1Inbox;\\n\\n    ArbitrumL1ERC20GatewayLike public immutable l1ERC20GatewayRouter;\\n\\n    /**\\n     * @notice Domain identifier used for Circle's CCTP bridge on Arbitrum.\\n     * @dev This identifier is assigned by Circle and is not related to a chain ID.\\n     * @dev Official domain list can be found here: https://developers.circle.com/stablecoins/docs/supported-domains\\n     */\\n    uint32 public constant circleDomainId = 3;\\n\\n    /**\\n     * @notice The official USDC contract address on this chain.\\n     * @dev Posted officially here: https://developers.circle.com/stablecoins/docs/usdc-on-main-networks\\n     */\\n    IERC20 public immutable l1Usdc;\\n\\n    /**\\n     * @notice The official Circle CCTP token bridge contract endpoint.\\n     * @dev Posted officially here: https://developers.circle.com/stablecoins/docs/evm-smart-contracts\\n     */\\n    ITokenMessenger public immutable cctpTokenMessenger;\\n\\n    /**\\n     * @notice Constructs new Adapter.\\n     * @param _l1ArbitrumInbox Inbox helper contract to send messages to Arbitrum.\\n     * @param _l1ERC20GatewayRouter ERC20 gateway router contract to send tokens to Arbitrum.\\n     * @param _l2RefundL2Address L2 address to receive gas refunds on after a message is relayed.\\n     * @param _l1Usdc USDC address on L1.\\n     * @param _cctpTokenMessenger TokenMessenger contract to bridge via CCTP.\\n     */\\n    constructor(\\n        ArbitrumL1InboxLike _l1ArbitrumInbox,\\n        ArbitrumL1ERC20GatewayLike _l1ERC20GatewayRouter,\\n        address _l2RefundL2Address,\\n        IERC20 _l1Usdc,\\n        ITokenMessenger _cctpTokenMessenger\\n    ) {\\n        l1Inbox = _l1ArbitrumInbox;\\n        l1ERC20GatewayRouter = _l1ERC20GatewayRouter;\\n        l2RefundL2Address = _l2RefundL2Address;\\n        l1Usdc = _l1Usdc;\\n        cctpTokenMessenger = _cctpTokenMessenger;\\n    }\\n\\n    /**\\n     * @notice Send cross-chain message to target on Arbitrum.\\n     * @notice This contract must hold at least getL1CallValue() amount of ETH to send a message via the Inbox\\n     * successfully, or the message will get stuck.\\n     * @param target Contract on Arbitrum that will receive message.\\n     * @param message Data to send to target.\\n     */\\n    function relayMessage(address target, bytes memory message) external payable override {\\n        uint256 requiredL1CallValue = _contractHasSufficientEthBalance(RELAY_MESSAGE_L2_GAS_LIMIT);\\n\\n        l1Inbox.createRetryableTicket{ value: requiredL1CallValue }(\\n            target, // destAddr destination L2 contract address\\n            0, // l2CallValue call value for retryable L2 message\\n            l2MaxSubmissionCost, // maxSubmissionCost Max gas deducted from user's L2 balance to cover base fee\\n            l2RefundL2Address, // excessFeeRefundAddress maxgas * gasprice - execution cost gets credited here on L2\\n            l2RefundL2Address, // callValueRefundAddress l2Callvalue gets credited here on L2 if retryable txn times out or gets cancelled\\n            RELAY_MESSAGE_L2_GAS_LIMIT, // maxGas Max gas deducted from user's L2 balance to cover L2 execution\\n            l2GasPrice, // gasPriceBid price bid for L2 execution\\n            message // data ABI encoded data of L2 message\\n        );\\n\\n        emit MessageRelayed(target, message);\\n    }\\n\\n    /**\\n     * @notice Bridge tokens to Arbitrum.\\n     * @notice This contract must hold at least getL1CallValue() amount of ETH to send a message via the Inbox\\n     * successfully, or the message will get stuck.\\n     * @param l1Token L1 token to deposit.\\n     * @param l2Token L2 token to receive.\\n     * @param amount Amount of L1 tokens to deposit and L2 tokens to receive.\\n     * @param to Bridge recipient.\\n     */\\n    function relayTokens(\\n        address l1Token,\\n        address l2Token, // l2Token is unused for Arbitrum.\\n        uint256 amount,\\n        address to\\n    ) external payable override {\\n        // Check if this token is USDC, which requires a custom bridge via CCTP.\\n        if (address(l1Usdc) == l1Token) {\\n            CircleCCTPLib._transferUsdc(l1Usdc, cctpTokenMessenger, circleDomainId, to, amount);\\n        }\\n        // If not, we can use the Arbitrum gateway\\n        else {\\n            uint256 requiredL1CallValue = _contractHasSufficientEthBalance(RELAY_TOKENS_L2_GAS_LIMIT);\\n\\n            // Approve the gateway, not the router, to spend the hub pool's balance. The gateway, which is different\\n            // per L1 token, will temporarily escrow the tokens to be bridged and pull them from this contract.\\n            address erc20Gateway = l1ERC20GatewayRouter.getGateway(l1Token);\\n            IERC20(l1Token).safeIncreaseAllowance(erc20Gateway, amount);\\n\\n            // `outboundTransfer` expects that the caller includes a bytes message as the last param that includes the\\n            // maxSubmissionCost to use when creating an L2 retryable ticket: https://github.com/OffchainLabs/arbitrum/blob/e98d14873dd77513b569771f47b5e05b72402c5e/packages/arb-bridge-peripherals/contracts/tokenbridge/ethereum/gateway/L1GatewayRouter.sol#L232\\n            bytes memory data = abi.encode(l2MaxSubmissionCost, \\\"\\\");\\n\\n            // Note: Legacy routers don't have the outboundTransferCustomRefund method, so default to using\\n            // outboundTransfer(). Legacy routers are used for the following tokens that are currently enabled:\\n            // - DAI: the implementation of `outboundTransfer` at the current DAI custom gateway\\n            //        (https://etherscan.io/address/0xD3B5b60020504bc3489D6949d545893982BA3011#writeContract) sets the\\n            //        sender as the refund address so the aliased HubPool should receive excess funds. Implementation here:\\n            //        https://github.com/makerdao/arbitrum-dai-bridge/blob/11a80385e2622968069c34d401b3d54a59060e87/contracts/l1/L1DaiGateway.sol#L109\\n            if (l1Token == 0x6B175474E89094C44Da98b954EedeAC495271d0F) {\\n                // This means that the excess ETH to pay for the L2 transaction will be sent to the aliased\\n                // contract address on L2, which we'd have to retrieve via a custom adapter, the Arbitrum_RescueAdapter.\\n                // To do so, in a single transaction: 1) setCrossChainContracts to Arbitrum_RescueAdapter, 2) relayMessage\\n                // with function data = abi.encode(amountToRescue), 3) setCrossChainContracts back to this adapter.\\n                l1ERC20GatewayRouter.outboundTransfer{ value: requiredL1CallValue }(\\n                    l1Token,\\n                    to,\\n                    amount,\\n                    RELAY_TOKENS_L2_GAS_LIMIT,\\n                    l2GasPrice,\\n                    data\\n                );\\n            } else {\\n                l1ERC20GatewayRouter.outboundTransferCustomRefund{ value: requiredL1CallValue }(\\n                    l1Token,\\n                    l2RefundL2Address,\\n                    to,\\n                    amount,\\n                    RELAY_TOKENS_L2_GAS_LIMIT,\\n                    l2GasPrice,\\n                    data\\n                );\\n            }\\n        }\\n        emit TokensRelayed(l1Token, l2Token, amount, to);\\n    }\\n\\n    /**\\n     * @notice Returns required amount of ETH to send a message via the Inbox.\\n     * @return amount of ETH that this contract needs to hold in order for relayMessage to succeed.\\n     */\\n    function getL1CallValue(uint32 l2GasLimit) public pure returns (uint256) {\\n        return l2MaxSubmissionCost + l2GasPrice * l2GasLimit;\\n    }\\n\\n    function _contractHasSufficientEthBalance(uint32 l2GasLimit) internal view returns (uint256 requiredL1CallValue) {\\n        requiredL1CallValue = getL1CallValue(l2GasLimit);\\n        require(address(this).balance >= requiredL1CallValue, \\\"Insufficient ETH balance\\\");\\n    }\\n}\\n\",\"keccak256\":\"0x771c65fa042c257ccc5b49606de403875f5a33169d358cdea32c19a03f5f89c2\",\"license\":\"BUSL-1.1\"},\"contracts/chain-adapters/interfaces/AdapterInterface.sol\":{\"content\":\"// SPDX-License-Identifier: BUSL-1.1\\npragma solidity ^0.8.0;\\n\\n/**\\n * @notice Sends cross chain messages and tokens to contracts on a specific L2 network.\\n * This interface is implemented by an adapter contract that is deployed on L1.\\n */\\n\\ninterface AdapterInterface {\\n    event MessageRelayed(address target, bytes message);\\n\\n    event TokensRelayed(address l1Token, address l2Token, uint256 amount, address to);\\n\\n    /**\\n     * @notice Send message to `target` on L2.\\n     * @dev This method is marked payable because relaying the message might require a fee\\n     * to be paid by the sender to forward the message to L2. However, it will not send msg.value\\n     * to the target contract on L2.\\n     * @param target L2 address to send message to.\\n     * @param message Message to send to `target`.\\n     */\\n    function relayMessage(address target, bytes calldata message) external payable;\\n\\n    /**\\n     * @notice Send `amount` of `l1Token` to `to` on L2. `l2Token` is the L2 address equivalent of `l1Token`.\\n     * @dev This method is marked payable because relaying the message might require a fee\\n     * to be paid by the sender to forward the message to L2. However, it will not send msg.value\\n     * to the target contract on L2.\\n     * @param l1Token L1 token to bridge.\\n     * @param l2Token L2 token to receive.\\n     * @param amount Amount of `l1Token` to bridge.\\n     * @param to Bridge recipient.\\n     */\\n    function relayTokens(\\n        address l1Token,\\n        address l2Token,\\n        uint256 amount,\\n        address to\\n    ) external payable;\\n}\\n\",\"keccak256\":\"0x1d52fcb8b10dc7f260345918c1a90d496a4c9f774402cbd5ebde881b8fed6d50\",\"license\":\"BUSL-1.1\"},\"contracts/external/interfaces/CCTPInterfaces.sol\":{\"content\":\"/**\\n * Copyright (C) 2015, 2016, 2017 Dapphub\\n *\\n * This program is free software: you can redistribute it and/or modify\\n * it under the terms of the GNU General Public License as published by\\n * the Free Software Foundation, either version 3 of the License, or\\n * (at your option) any later version.\\n *\\n * This program is distributed in the hope that it will be useful,\\n * but WITHOUT ANY WARRANTY; without even the implied warranty of\\n * MERCHANTABILITY or FITNESS FOR A PARTICULAR PURPOSE.  See the\\n * GNU General Public License for more details.\\n *\\n * You should have received a copy of the GNU General Public License\\n * along with this program.  If not, see <http://www.gnu.org/licenses/>.\\n */\\n\\n// SPDX-License-Identifier: GPL-3.0-or-later\\npragma solidity ^0.8.0;\\n\\n/**\\n * Imported as-is from commit 139d8d0ce3b5531d3c7ec284f89d946dfb720016 of:\\n *   * https://github.com/walkerq/evm-cctp-contracts/blob/139d8d0ce3b5531d3c7ec284f89d946dfb720016/src/TokenMessenger.sol\\n * Changes applied post-import:\\n *   * Removed a majority of code from this contract and converted the needed function signatures in this interface.\\n */\\ninterface ITokenMessenger {\\n    /**\\n     * @notice Deposits and burns tokens from sender to be minted on destination domain.\\n     * Emits a `DepositForBurn` event.\\n     * @dev reverts if:\\n     * - given burnToken is not supported\\n     * - given destinationDomain has no TokenMessenger registered\\n     * - transferFrom() reverts. For example, if sender's burnToken balance or approved allowance\\n     * to this contract is less than `amount`.\\n     * - burn() reverts. For example, if `amount` is 0.\\n     * - MessageTransmitter returns false or reverts.\\n     * @param amount amount of tokens to burn\\n     * @param destinationDomain destination domain\\n     * @param mintRecipient address of mint recipient on destination domain\\n     * @param burnToken address of contract to burn deposited tokens, on local domain\\n     * @return _nonce unique nonce reserved by message\\n     */\\n    function depositForBurn(\\n        uint256 amount,\\n        uint32 destinationDomain,\\n        bytes32 mintRecipient,\\n        address burnToken\\n    ) external returns (uint64 _nonce);\\n}\\n\",\"keccak256\":\"0x6bb3f6d8142bf040827d7171a5ad3bdce7f83da49c4f828034ac4df3fba6187d\",\"license\":\"GPL-3.0-or-later\"},\"contracts/libraries/CircleCCTPLib.sol\":{\"content\":\"// SPDX-License-Identifier: BUSL-1.1\\npragma solidity ^0.8.0;\\n\\nimport \\\"@openzeppelin/contracts/token/ERC20/IERC20.sol\\\";\\nimport \\\"@openzeppelin/contracts/token/ERC20/utils/SafeERC20.sol\\\";\\nimport \\\"../external/interfaces/CCTPInterfaces.sol\\\";\\n\\nlibrary CircleCCTPLib {\\n    using SafeERC20 for IERC20;\\n\\n    /**\\n     * @notice converts address to bytes32 (alignment preserving cast.)\\n     * @param addr the address to convert to bytes32\\n     * @dev Sourced from the official CCTP repo: https://github.com/walkerq/evm-cctp-contracts/blob/139d8d0ce3b5531d3c7ec284f89d946dfb720016/src/messages/Message.sol#L142C1-L148C6\\n     */\\n    function _addressToBytes32(address addr) internal pure returns (bytes32) {\\n        return bytes32(uint256(uint160(addr)));\\n    }\\n\\n    /**\\n     * @notice Transfers USDC from the current domain to the given address on the new domain.\\n     * @param usdcToken USDC token contract on the current domain.\\n     * @param tokenMessenger TokenMessenger contract to bridge via CCTP.\\n     * @param circleDomain The new domain to transfer USDC to.\\n     * @param to Address to receive USDC on the new domain.\\n     * @param amount Amount of USDC to transfer.\\n     */\\n    function _transferUsdc(\\n        IERC20 usdcToken,\\n        ITokenMessenger tokenMessenger,\\n        uint32 circleDomain,\\n        address to,\\n        uint256 amount\\n    ) internal {\\n        // Only approve the exact amount to be transferred\\n        usdcToken.safeIncreaseAllowance(address(tokenMessenger), amount);\\n        // Submit the amount to be transferred to bridged via the TokenMessenger\\n        tokenMessenger.depositForBurn(amount, circleDomain, _addressToBytes32(to), address(usdcToken));\\n    }\\n}\\n\",\"keccak256\":\"0x73c5c00c86016ea90505977dfeae2500077f5f83ce897a042415bc2f2fbac161\",\"license\":\"BUSL-1.1\"}},\"version\":1}",
  "bytecode": "0x6101203461010357601f61119538819003918201601f19168301916001600160401b038311848410176101075780849260a0946040528339810103126101035780516001600160a01b03919082811681036101035760208201518381168103610103576040830151918483168303610103576060840151938585168503610103576080015194851685036101035760a05260c05260805260e052610100908152604051611079918261011c83396080518281816101aa015281816104010152610926015260a051828181610204015261051a015260c0518281816107710152610b47015260e051828181610588015261061e0152518181816104ac01526106570152f35b5f80fd5b634e487b7160e01b5f52604160045260245ffdfe6080604081815260049182361015610015575f80fd5b5f3560e01c9081631ba4a9cb14610aff575080631fc1ba7614610a6457806328f2716e14610a2957806352c8c75c146105ac57806356c3b5871461053e5780638134f385146104d05780639748cf7c146104625780639ae36685146104255780639c3ba200146103b7578063c735281e1461037c578063ce9ca77514610343578063e599477e146103045763e6eb8ade146100ae575f80fd5b807ffffffffffffffffffffffffffffffffffffffffffffffffffffffffffffffffc360112610293576100df610b6b565b916024359167ffffffffffffffff8311610293573660238401121561029357828201359361010c85610c18565b9461011983519687610bd7565b808652602094366024838301011161029357815f926024889301838a01378701015266470de4df820000908147106102a857849073ffffffffffffffffffffffffffffffffffffffff8091855194859384927f679b6ded0000000000000000000000000000000000000000000000000000000084521680988301525f6024830152662386f26fc100006044830152827f0000000000000000000000000000000000000000000000000000000000000000168060648401526084830152621e848060a483015264012a05f20060c483015261010060e48301528161020061010482018c610cd5565b03927f0000000000000000000000000000000000000000000000000000000000000000165af1801561029e57610270575b507f9e6c52944e331ba6270e7fe4cea2a4086bae8f7a27e1cdba07f416806f5d0ac493818061026b93519586958652850152830190610cd5565b0390a1005b8390813d8311610297575b6102858183610bd7565b81010312610293575f610231565b5f80fd5b503d61027b565b82513d5f823e3d90fd5b606484868551917f08c379a0000000000000000000000000000000000000000000000000000000008352820152601860248201527f496e73756666696369656e74204554482062616c616e636500000000000000006044820152fd5b5034610293575f7ffffffffffffffffffffffffffffffffffffffffffffffffffffffffffffffffc3601126102935760209051662386f26fc100008152f35b5034610293575f7ffffffffffffffffffffffffffffffffffffffffffffffffffffffffffffffffc360112610293576020905160038152f35b5034610293575f7ffffffffffffffffffffffffffffffffffffffffffffffffffffffffffffffffc3601126102935760209051621e84808152f35b5034610293575f7ffffffffffffffffffffffffffffffffffffffffffffffffffffffffffffffffc360112610293576020905173ffffffffffffffffffffffffffffffffffffffff7f0000000000000000000000000000000000000000000000000000000000000000168152f35b5034610293575f7ffffffffffffffffffffffffffffffffffffffffffffffffffffffffffffffffc360112610293576020905164012a05f2008152f35b5034610293575f7ffffffffffffffffffffffffffffffffffffffffffffffffffffffffffffffffc360112610293576020905173ffffffffffffffffffffffffffffffffffffffff7f0000000000000000000000000000000000000000000000000000000000000000168152f35b5034610293575f7ffffffffffffffffffffffffffffffffffffffffffffffffffffffffffffffffc360112610293576020905173ffffffffffffffffffffffffffffffffffffffff7f0000000000000000000000000000000000000000000000000000000000000000168152f35b5034610293575f7ffffffffffffffffffffffffffffffffffffffffffffffffffffffffffffffffc360112610293576020905173ffffffffffffffffffffffffffffffffffffffff7f0000000000000000000000000000000000000000000000000000000000000000168152f35b509060807ffffffffffffffffffffffffffffffffffffffffffffffffffffffffffffffffc360112610293576105e0610b6b565b906024803573ffffffffffffffffffffffffffffffffffffffff808216809203610293576044359260643594828616809603610293579582169584907f000000000000000000000000000000000000000000000000000000000000000084811689810361075957608492915f9161067e86602098997f0000000000000000000000000000000000000000000000000000000000000000168094610d18565b60038d5198899788967f6fd3504e0000000000000000000000000000000000000000000000000000000088528701528501528a604485015260648401525af1801561074f57610707575b50907fd7e09655439c3932e55857df3220186e5a7f0980825f20691c2b35d941dee75b9460809493925b815194855260208501528301526060820152a1005b60209493929194813d602011610747575b8161072560209383610bd7565b81010312610293575167ffffffffffffffff811603610293579091925f6106c8565b3d9150610718565b86513d5f823e3d90fd5b50509190506628db3066eac000918247106109ce57837f000000000000000000000000000000000000000000000000000000000000000016908951937fbda009fe00000000000000000000000000000000000000000000000000000000855289828601526020858581865afa9182156109c457888b938b975f9161097b575b50906107e49185610d18565b8b5196662386f26fc1000060208901528c808901525f60608901526060885261080c88610b8e565b736b175474e89094c44da98b954eedeac495271d0f84036108ec575061088b5f96978d51988997889687957fd2ce7d650000000000000000000000000000000000000000000000000000000087528601528401528a6044840152620493e0606484015264012a05f200608484015260c060a484015260c4830190610cd5565b03925af1801561074f57917fd7e09655439c3932e55857df3220186e5a7f0980825f20691c2b35d941dee75b96916080969594936108ca575b506106f2565b6108e5903d805f833e6108dd8183610bd7565b810190610c73565b505f6108c4565b94965f965061088b908d51988997889687957f4fb1a07b0000000000000000000000000000000000000000000000000000000087528601527f000000000000000000000000000000000000000000000000000000000000000016908401528b60448401528a6064840152620493e0608484015264012a05f20060a484015260e060c484015260e4830190610cd5565b939450505094506020813d6020116109bc575b8161099b60209383610bd7565b8101031261029357519085821682036102935788948a9289906107e46107d8565b3d915061098e565b8b513d5f823e3d90fd5b601860649260208b51937f08c379a00000000000000000000000000000000000000000000000000000000085528401528201527f496e73756666696369656e74204554482062616c616e636500000000000000006044820152fd5b5034610293575f7ffffffffffffffffffffffffffffffffffffffffffffffffffffffffffffffffc3601126102935760209051620493e08152f35b50346102935760207ffffffffffffffffffffffffffffffffffffffffffffffffffffffffffffffffc3601126102935781359063ffffffff82168092036102935764012a05f2009180830292830403610ad357662386f26fc10000918201809211610ad3576020925051908152f35b6011837f4e487b71000000000000000000000000000000000000000000000000000000005f525260245ffd5b34610293575f7ffffffffffffffffffffffffffffffffffffffffffffffffffffffffffffffffc3601126102935760209073ffffffffffffffffffffffffffffffffffffffff7f0000000000000000000000000000000000000000000000000000000000000000168152f35b6004359073ffffffffffffffffffffffffffffffffffffffff8216820361029357565b6080810190811067ffffffffffffffff821117610baa57604052565b7f4e487b71000000000000000000000000000000000000000000000000000000005f52604160045260245ffd5b90601f7fffffffffffffffffffffffffffffffffffffffffffffffffffffffffffffffe0910116810190811067ffffffffffffffff821117610baa57604052565b67ffffffffffffffff8111610baa57601f017fffffffffffffffffffffffffffffffffffffffffffffffffffffffffffffffe01660200190565b5f5b838110610c635750505f910152565b8181015183820152602001610c54565b6020818303126102935780519067ffffffffffffffff8211610293570181601f82011215610293578051610ca681610c18565b92610cb46040519485610bd7565b8184526020828401011161029357610cd29160208085019101610c52565b90565b907fffffffffffffffffffffffffffffffffffffffffffffffffffffffffffffffe0601f602093610d1181518092818752878088019101610c52565b0116010190565b9073ffffffffffffffffffffffffffffffffffffffff809216906040928351917fdd62ed3e00000000000000000000000000000000000000000000000000000000835230600484015216918260248301526020948583604481855afa928315610f69575f93610f3a575b508201809211610f0d57835191858301937f095ea7b30000000000000000000000000000000000000000000000000000000085526024840152604483015260448252610dcd82610b8e565b83519184830183811067ffffffffffffffff821117610baa5785528583527f5361666545524332303a206c6f772d6c6576656c2063616c6c206661696c65648387015251610e48935f91829182855af13d15610f05573d91610e2e83610c18565b92610e3b87519485610bd7565b83523d5f8885013e610f73565b8051838115918215610ee5575b5050905015610e62575050565b6084925051907f08c379a00000000000000000000000000000000000000000000000000000000082526004820152602a60248201527f5361666545524332303a204552433230206f7065726174696f6e20646964206e60448201527f6f742073756363656564000000000000000000000000000000000000000000006064820152fd5b83809293500103126102935782015180151581036102935780835f610e55565b606091610f73565b7f4e487b71000000000000000000000000000000000000000000000000000000005f52601160045260245ffd5b9092508581813d8311610f62575b610f528183610bd7565b810103126102935751915f610d82565b503d610f48565b85513d5f823e3d90fd5b91929015610fee5750815115610f87575090565b3b15610f905790565b60646040517f08c379a000000000000000000000000000000000000000000000000000000000815260206004820152601d60248201527f416464726573733a2063616c6c20746f206e6f6e2d636f6e74726163740000006044820152fd5b8251909150156110015750805190602001fd5b61103f906040519182917f08c379a0000000000000000000000000000000000000000000000000000000008352602060048401526024830190610cd5565b0390fdfea26469706673582212203b4076320bfdd539ce17fdb5bbd57247cae40c93d8947fff6ec96bafd03e1b1164736f6c63430008170033",
  "deployedBytecode": "0x6080604081815260049182361015610015575f80fd5b5f3560e01c9081631ba4a9cb14610aff575080631fc1ba7614610a6457806328f2716e14610a2957806352c8c75c146105ac57806356c3b5871461053e5780638134f385146104d05780639748cf7c146104625780639ae36685146104255780639c3ba200146103b7578063c735281e1461037c578063ce9ca77514610343578063e599477e146103045763e6eb8ade146100ae575f80fd5b807ffffffffffffffffffffffffffffffffffffffffffffffffffffffffffffffffc360112610293576100df610b6b565b916024359167ffffffffffffffff8311610293573660238401121561029357828201359361010c85610c18565b9461011983519687610bd7565b808652602094366024838301011161029357815f926024889301838a01378701015266470de4df820000908147106102a857849073ffffffffffffffffffffffffffffffffffffffff8091855194859384927f679b6ded0000000000000000000000000000000000000000000000000000000084521680988301525f6024830152662386f26fc100006044830152827f0000000000000000000000000000000000000000000000000000000000000000168060648401526084830152621e848060a483015264012a05f20060c483015261010060e48301528161020061010482018c610cd5565b03927f0000000000000000000000000000000000000000000000000000000000000000165af1801561029e57610270575b507f9e6c52944e331ba6270e7fe4cea2a4086bae8f7a27e1cdba07f416806f5d0ac493818061026b93519586958652850152830190610cd5565b0390a1005b8390813d8311610297575b6102858183610bd7565b81010312610293575f610231565b5f80fd5b503d61027b565b82513d5f823e3d90fd5b606484868551917f08c379a0000000000000000000000000000000000000000000000000000000008352820152601860248201527f496e73756666696369656e74204554482062616c616e636500000000000000006044820152fd5b5034610293575f7ffffffffffffffffffffffffffffffffffffffffffffffffffffffffffffffffc3601126102935760209051662386f26fc100008152f35b5034610293575f7ffffffffffffffffffffffffffffffffffffffffffffffffffffffffffffffffc360112610293576020905160038152f35b5034610293575f7ffffffffffffffffffffffffffffffffffffffffffffffffffffffffffffffffc3601126102935760209051621e84808152f35b5034610293575f7ffffffffffffffffffffffffffffffffffffffffffffffffffffffffffffffffc360112610293576020905173ffffffffffffffffffffffffffffffffffffffff7f0000000000000000000000000000000000000000000000000000000000000000168152f35b5034610293575f7ffffffffffffffffffffffffffffffffffffffffffffffffffffffffffffffffc360112610293576020905164012a05f2008152f35b5034610293575f7ffffffffffffffffffffffffffffffffffffffffffffffffffffffffffffffffc360112610293576020905173ffffffffffffffffffffffffffffffffffffffff7f0000000000000000000000000000000000000000000000000000000000000000168152f35b5034610293575f7ffffffffffffffffffffffffffffffffffffffffffffffffffffffffffffffffc360112610293576020905173ffffffffffffffffffffffffffffffffffffffff7f0000000000000000000000000000000000000000000000000000000000000000168152f35b5034610293575f7ffffffffffffffffffffffffffffffffffffffffffffffffffffffffffffffffc360112610293576020905173ffffffffffffffffffffffffffffffffffffffff7f0000000000000000000000000000000000000000000000000000000000000000168152f35b509060807ffffffffffffffffffffffffffffffffffffffffffffffffffffffffffffffffc360112610293576105e0610b6b565b906024803573ffffffffffffffffffffffffffffffffffffffff808216809203610293576044359260643594828616809603610293579582169584907f000000000000000000000000000000000000000000000000000000000000000084811689810361075957608492915f9161067e86602098997f0000000000000000000000000000000000000000000000000000000000000000168094610d18565b60038d5198899788967f6fd3504e0000000000000000000000000000000000000000000000000000000088528701528501528a604485015260648401525af1801561074f57610707575b50907fd7e09655439c3932e55857df3220186e5a7f0980825f20691c2b35d941dee75b9460809493925b815194855260208501528301526060820152a1005b60209493929194813d602011610747575b8161072560209383610bd7565b81010312610293575167ffffffffffffffff811603610293579091925f6106c8565b3d9150610718565b86513d5f823e3d90fd5b50509190506628db3066eac000918247106109ce57837f000000000000000000000000000000000000000000000000000000000000000016908951937fbda009fe00000000000000000000000000000000000000000000000000000000855289828601526020858581865afa9182156109c457888b938b975f9161097b575b50906107e49185610d18565b8b5196662386f26fc1000060208901528c808901525f60608901526060885261080c88610b8e565b736b175474e89094c44da98b954eedeac495271d0f84036108ec575061088b5f96978d51988997889687957fd2ce7d650000000000000000000000000000000000000000000000000000000087528601528401528a6044840152620493e0606484015264012a05f200608484015260c060a484015260c4830190610cd5565b03925af1801561074f57917fd7e09655439c3932e55857df3220186e5a7f0980825f20691c2b35d941dee75b96916080969594936108ca575b506106f2565b6108e5903d805f833e6108dd8183610bd7565b810190610c73565b505f6108c4565b94965f965061088b908d51988997889687957f4fb1a07b0000000000000000000000000000000000000000000000000000000087528601527f000000000000000000000000000000000000000000000000000000000000000016908401528b60448401528a6064840152620493e0608484015264012a05f20060a484015260e060c484015260e4830190610cd5565b939450505094506020813d6020116109bc575b8161099b60209383610bd7565b8101031261029357519085821682036102935788948a9289906107e46107d8565b3d915061098e565b8b513d5f823e3d90fd5b601860649260208b51937f08c379a00000000000000000000000000000000000000000000000000000000085528401528201527f496e73756666696369656e74204554482062616c616e636500000000000000006044820152fd5b5034610293575f7ffffffffffffffffffffffffffffffffffffffffffffffffffffffffffffffffc3601126102935760209051620493e08152f35b50346102935760207ffffffffffffffffffffffffffffffffffffffffffffffffffffffffffffffffc3601126102935781359063ffffffff82168092036102935764012a05f2009180830292830403610ad357662386f26fc10000918201809211610ad3576020925051908152f35b6011837f4e487b71000000000000000000000000000000000000000000000000000000005f525260245ffd5b34610293575f7ffffffffffffffffffffffffffffffffffffffffffffffffffffffffffffffffc3601126102935760209073ffffffffffffffffffffffffffffffffffffffff7f0000000000000000000000000000000000000000000000000000000000000000168152f35b6004359073ffffffffffffffffffffffffffffffffffffffff8216820361029357565b6080810190811067ffffffffffffffff821117610baa57604052565b7f4e487b71000000000000000000000000000000000000000000000000000000005f52604160045260245ffd5b90601f7fffffffffffffffffffffffffffffffffffffffffffffffffffffffffffffffe0910116810190811067ffffffffffffffff821117610baa57604052565b67ffffffffffffffff8111610baa57601f017fffffffffffffffffffffffffffffffffffffffffffffffffffffffffffffffe01660200190565b5f5b838110610c635750505f910152565b8181015183820152602001610c54565b6020818303126102935780519067ffffffffffffffff8211610293570181601f82011215610293578051610ca681610c18565b92610cb46040519485610bd7565b8184526020828401011161029357610cd29160208085019101610c52565b90565b907fffffffffffffffffffffffffffffffffffffffffffffffffffffffffffffffe0601f602093610d1181518092818752878088019101610c52565b0116010190565b9073ffffffffffffffffffffffffffffffffffffffff809216906040928351917fdd62ed3e00000000000000000000000000000000000000000000000000000000835230600484015216918260248301526020948583604481855afa928315610f69575f93610f3a575b508201809211610f0d57835191858301937f095ea7b30000000000000000000000000000000000000000000000000000000085526024840152604483015260448252610dcd82610b8e565b83519184830183811067ffffffffffffffff821117610baa5785528583527f5361666545524332303a206c6f772d6c6576656c2063616c6c206661696c65648387015251610e48935f91829182855af13d15610f05573d91610e2e83610c18565b92610e3b87519485610bd7565b83523d5f8885013e610f73565b8051838115918215610ee5575b5050905015610e62575050565b6084925051907f08c379a00000000000000000000000000000000000000000000000000000000082526004820152602a60248201527f5361666545524332303a204552433230206f7065726174696f6e20646964206e60448201527f6f742073756363656564000000000000000000000000000000000000000000006064820152fd5b83809293500103126102935782015180151581036102935780835f610e55565b606091610f73565b7f4e487b71000000000000000000000000000000000000000000000000000000005f52601160045260245ffd5b9092508581813d8311610f62575b610f528183610bd7565b810103126102935751915f610d82565b503d610f48565b85513d5f823e3d90fd5b91929015610fee5750815115610f87575090565b3b15610f905790565b60646040517f08c379a000000000000000000000000000000000000000000000000000000000815260206004820152601d60248201527f416464726573733a2063616c6c20746f206e6f6e2d636f6e74726163740000006044820152fd5b8251909150156110015750805190602001fd5b61103f906040519182917f08c379a0000000000000000000000000000000000000000000000000000000008352602060048401526024830190610cd5565b0390fdfea26469706673582212203b4076320bfdd539ce17fdb5bbd57247cae40c93d8947fff6ec96bafd03e1b1164736f6c63430008170033",
  "devdoc": {
    "details": "Public functions calling external contracts do not guard against reentrancy because they are expected to be called via delegatecall, which will execute this contract's logic within the context of the originating contract. For example, the HubPool will delegatecall these functions, therefore its only necessary that the HubPool's methods that call this contract's logic guard against reentrancy.",
    "kind": "dev",
    "methods": {
      "constructor": {
        "params": {
          "_cctpTokenMessenger": "TokenMessenger contract to bridge via CCTP.",
          "_l1ArbitrumInbox": "Inbox helper contract to send messages to Arbitrum.",
          "_l1ERC20GatewayRouter": "ERC20 gateway router contract to send tokens to Arbitrum.",
          "_l1Usdc": "USDC address on L1.",
          "_l2RefundL2Address": "L2 address to receive gas refunds on after a message is relayed."
        }
      },
      "getL1CallValue(uint32)": {
        "returns": {
          "_0": "amount of ETH that this contract needs to hold in order for relayMessage to succeed."
        }
      },
      "relayMessage(address,bytes)": {
        "params": {
          "message": "Data to send to target.",
          "target": "Contract on Arbitrum that will receive message."
        }
      },
      "relayTokens(address,address,uint256,address)": {
        "params": {
          "amount": "Amount of L1 tokens to deposit and L2 tokens to receive.",
          "l1Token": "L1 token to deposit.",
          "l2Token": "L2 token to receive.",
          "to": "Bridge recipient."
        }
      }
    },
    "stateVariables": {
      "cctpTokenMessenger": {
        "details": "Posted officially here: https://developers.circle.com/stablecoins/docs/evm-smart-contracts"
      },
      "circleDomainId": {
        "details": "This identifier is assigned by Circle and is not related to a chain ID.Official domain list can be found here: https://developers.circle.com/stablecoins/docs/supported-domains"
      },
      "l1Usdc": {
        "details": "Posted officially here: https://developers.circle.com/stablecoins/docs/usdc-on-main-networks"
      }
    },
    "version": 1
  },
  "userdoc": {
    "kind": "user",
    "methods": {
      "cctpTokenMessenger()": {
        "notice": "The official Circle CCTP token bridge contract endpoint."
      },
      "circleDomainId()": {
        "notice": "Domain identifier used for Circle's CCTP bridge on Arbitrum."
      },
      "constructor": {
        "notice": "Constructs new Adapter."
      },
      "getL1CallValue(uint32)": {
        "notice": "Returns required amount of ETH to send a message via the Inbox."
      },
      "l1Usdc()": {
        "notice": "The official USDC contract address on this chain."
      },
      "relayMessage(address,bytes)": {
        "notice": "Send cross-chain message to target on Arbitrum.This contract must hold at least getL1CallValue() amount of ETH to send a message via the Inbox successfully, or the message will get stuck."
      },
      "relayTokens(address,address,uint256,address)": {
        "notice": "Bridge tokens to Arbitrum.This contract must hold at least getL1CallValue() amount of ETH to send a message via the Inbox successfully, or the message will get stuck."
      }
    },
    "notice": "Contract containing logic to send messages from L1 to Arbitrum.",
    "version": 1
  },
  "storageLayout": {
    "storage": [],
    "types": null
  }
}
